{
  "name": "Faringoamigdalite viral",
  "physicalExamAddons": [
    "geral-bom",
    "cv-normal",
    "resp-normal",
    "oroscopia-hiperemia"
  ],
  "conduct": [
    "Explico sobre a condição e esclareço dúvidas",
    "Prescrevo sintomáticos para casa",
    "Oriento sinais de alarme para retorno ao pronto-socorro"
  ],
  "prescriptionGroups": [
    {
      "id": "sintomaticos",
      "label": "Sintomáticos",
      "items": [
        {
          "type": "med",
          "medId": "flurbiprofeno-pastilha",
          "checked": true
        },
        {
          "type": "class",
          "classId": "aine",
          "default": "cetoprofeno-100mg",
          "checked": true
        },
        {
          "type": "class",
          "classId": "analgesico",
          "default": "dipirona-1g",
          "checked": true
        }
      ]
    }
  ]
}
