{
  "name": "Rinossinusite bacteriana",
  "physicalExamAddons": [
    "geral-bom",
    "cv-normal",
    "resp-normal",
    "oroscopia-hiperemia"
  ],
  "conduct": [
    "Explico sobre a condição e esclareço dúvidas",
    "Prescrevo antibioticoterapia",
    "Oriento lavagem nasal frequente",
    "Prescrevo sintomáticos para casa",
    "Oriento sinais de alarme para retorno ao pronto-socorro"
  ],
  "prescriptionGroups": [
    {
      "id": "antibiotico",
      "label": "Antibiótico",
      "type": "radio",
      "options": [
        "amoxicilina-clavulanato-875mg",
        "azitromicina-500mg",
        "levofloxacino-750mg"
      ],
      "default": "amoxicilina-clavulanato-875mg"
    },
    {
      "id": "sintomaticos",
      "label": "Sintomáticos",
      "items": [
        {
          "type": "med",
          "medId": "lavagem-nasal",
          "checked": true
        },
        {
          "type": "med",
          "medId": "xarope-44e",
          "checked": true
        },
        {
          "type": "class",
          "classId": "aine",
          "default": "cetoprofeno-100mg",
          "checked": true
        },
        {
          "type": "class",
          "classId": "analgesico",
          "default": "dipirona-500mg",
          "checked": true
        }
      ]
    }
  ]
}
