{
  "name": "ITU não complicada",
  "physicalExamAddons": [
    "geral-bom",
    "cv-normal",
    "resp-normal",
    "abdome-normal",
    "giordano-negativo"
  ],
  "conduct": [
    "Explico sobre a condição e esclareço dúvidas",
    "Prescrevo antibioticoterapia",
    "Oriento hidratação abundante",
    "Prescrevo sintomáticos para casa",
    "Oriento sinais de alarme para retorno ao pronto-socorro"
  ],
  "prescriptionGroups": [
    {
      "id": "antibiotico",
      "label": "Antibiótico",
      "type": "radio",
      "options": [
        "fosfomicina-3g",
        "nitrofurantoina-100mg",
        "cefalexina-500mg",
        "cefuroxima-250mg",
        "sulfametoxazol-trimetoprima"
      ],
      "default": "fosfomicina-3g"
    },
    {
      "id": "sintomaticos",
      "label": "Sintomáticos",
      "items": [
        {
          "type": "med",
          "medId": "fenazopiridina-200mg",
          "checked": true
        },
        {
          "type": "class",
          "classId": "analgesico",
          "default": "dipirona-500mg",
          "checked": true
        }
      ]
    }
  ]
}
